{
  "published_document_id": "pd_01HABCDEF123456789",
  "doc_id": "doc_annual_report_2025",
  "source_file_id": "sf_01HABCDEF123456789",
  "intake_job_id": "job_01HABCDEF123456789",
  "tenant_id": "tenant_acme",
  "collection_id": "col_default",
  "state": "PUBLISHED",
  "version": 1,
  "created_at": "2026-05-27T10:30:00Z",
  "updated_at": "2026-05-27T10:30:00Z"
}
